{
  "id": "oai:arXiv.org:2609.00005v1",
  "title": "Incremental Risk Assessment of Progressive Elder Financial Scams via Instruction-Tuned Small Language Models",
  "source": "rss",
  "url": "https://arxiv.org/abs/2609.00005",
  "category": "paper-or-talk",
  "collected_at": "2026-09-02T08:07:16Z",
  "analyzed_at": "2026-09-02T08:07:17Z",
  "organized_at": "2026-09-02T08:10:32Z",
  "summary": "该论文提出了一种针对老年人金融诈骗的增量式风险评估框架，通过指令微调小型语言模型，在对话的每个轮次累积更新风险估计，以应对诈骗信号逐步显现的特点。研究构建了包含投资、慈善、技术支持等场景的多轮对话数据集，并微调了Phi-4、LLaMA-3.2等小型模型，验证了其在资源受限设备上的有效性。该工作为移动端隐私保护的实时诈骗检测提供了新思路，值得关注。",
  "tags": [
    "financial-scam-detection",
    "small-language-models",
    "incremental-risk-assessment",
    "instruction-tuning",
    "on-device-ai"
  ],
  "relevance_score": 0.62,
  "meta": {
    "feed_name": "arxiv-cs-ai",
    "author": "Parviz Ghafariasl, Weimin Fu, Xiaolong Guo, Shing I. Chang",
    "published": "Wed, 02 Sep 2026 00:00:00 -0400"
  }
}
