{
  "id": "oai:arXiv.org:2610.00197v1",
  "title": "Comedic Fool's Gold: Reward Exploits and Countermeasures in Conversational Humor",
  "source": "rss",
  "url": "https://arxiv.org/abs/2610.00197",
  "category": "paper-or-talk",
  "collected_at": "2026-10-02T08:06:58Z",
  "analyzed_at": "2026-10-02T08:06:58Z",
  "organized_at": "2026-10-02T08:09:25Z",
  "summary": "本文研究对话幽默场景下语言模型训练奖励的漏洞与对策。作者设计了两类奖励：基于嵌入的\"意外感\"奖励和基于受众模型的\"预期发笑\"奖励，并通过受控实验发现前者会把词序打乱的回复误判为妙语，后者则会被对话中的笑声线索欺骗。加入流畅度过滤和跨说话人归一化虽能封堵已知攻击，但会误伤部分真正的妙语，且未匹配的表达仍可被利用。三轮强化学习实验显示最终版本综合评分提升0.0903、零分会话减少40%，但幽默专项提升仍未达预注册目标，揭示了自动奖励设计中\"堵捷径\"与\"保行为\"之间的根本张力。",
  "tags": [
    "reward-hacking",
    "conversational-humor",
    "rlhf",
    "reward-model",
    "llm-training"
  ],
  "relevance_score": 0.61,
  "meta": {
    "feed_name": "arxiv-cs-ai",
    "author": "Sam Larson",
    "published": "Fri, 02 Oct 2026 00:00:00 -0400"
  }
}
