{
  "id": "oai:arXiv.org:2608.21567v1",
  "title": "Quantifying geographic domain shift to decouple the geospatial transferability of human mobility flow generation models",
  "source": "rss",
  "url": "https://arxiv.org/abs/2608.21567",
  "category": "paper-or-talk",
  "collected_at": "2026-08-25T08:13:55Z",
  "analyzed_at": "2026-08-25T08:13:56Z",
  "organized_at": "2026-08-25T08:17:02Z",
  "summary": "该研究系统性地探讨了人类移动性生成模型的地理空间可迁移性问题，这是评估模型在新区域表现的关键维度。作者受机器学习领域自适应理论启发，引入“地理域偏移”概念，并提出互信息和空间偏移两个量化指标，以描述源区域与目标区域在地理特征分布和空间结构上的差异。通过在美国2265个县的通勤流数据上测试四个代表性模型，并采用线性混合效应回归分析，发现模型迁移性能存在显著的空间异质性和不对称性，且信息偏移与空间偏移对迁移性具有互补的解释力。该研究为评估和改进移动性生成模型的可迁移性提供了新框架，对GeoAI模型开发具有重要参考价值。",
  "tags": [
    "geospatial-transferability",
    "human-mobility",
    "domain-shift",
    "geoai",
    "model-evaluation"
  ],
  "relevance_score": 0.6,
  "meta": {
    "feed_name": "arxiv-cs-ai",
    "author": "Zhiyong Zhou, Song Gao, Qianheng Zhang, Feng Zhang, Zhenhong Du",
    "published": "Tue, 25 Aug 2026 00:00:00 -0400"
  }
}
