{
  "id": "49088058",
  "title": "MCP 2026-07-28 Specification: transport going stateless",
  "source": "hackernews-top",
  "url": "https://blog.modelcontextprotocol.io/posts/2026-07-28/",
  "category": "article-or-news",
  "collected_at": "2026-07-29T07:02:30Z",
  "analyzed_at": "2026-07-29T01:24:34Z",
  "organized_at": "2026-07-29T12:00:00Z",
  "summary": "MCP 官方发布 2026-07-28 规范更新，核心变化是 transport 走向 stateless（无状态）。这是 AI agent 生态的基础设施级动向：stateless transport 直接影响 MCP server/client 的实现方式、可扩展性与无状态部署模式，所有接入 MCP 的工程师都需要据此评估迁移。虽以博客形式发布，实为协议规范文档，工程落地性极高。",
  "tags": ["mcp", "protocol-spec", "stateless-transport", "agent-infrastructure"],
  "relevance_score": 0.88,
  "meta": {
    "author": "Eldodi",
    "comments": 29,
    "time": 1785263711
  }
}
