{
  "id": "oai:arXiv.org:2610.36325v1",
  "title": "Ontology-guided multi-agent reasoning for explainable differential diagnosis",
  "source": "rss",
  "url": "https://arxiv.org/abs/2610.36325",
  "category": "paper-or-talk",
  "collected_at": "2026-10-28T08:05:27Z",
  "analyzed_at": "2026-10-28T08:05:28Z",
  "organized_at": "2026-10-28T08:08:09Z",
  "summary": "该论文提出一种本体引导的多智能体鉴别诊断框架，用专家构建的医学知识库约束 LLM 推理，把诊断拆解为可审计的显式步骤，并主动识别最具区分度的缺失症状、生成针对性追问以降低不确定性。它针对的是 LLM 在临床推理中依赖模式匹配、结论缺乏证据支撑且过程不透明的问题，通过本体 grounding 减少幻觉、提升可追溯性与一致性。对关注医疗 Agent、知识图谱增强推理和可解释 AI 的研究者与工程团队有参考价值，且已开源。",
  "tags": [
    "medical-diagnosis",
    "multi-agent",
    "ontology-grounding",
    "explainable-ai",
    "clinical-reasoning"
  ],
  "relevance_score": 0.6,
  "meta": {
    "feed_name": "arxiv-cs-ai",
    "author": "Roxana Ramona Szomiu, George Ursu, Adrian Groza",
    "published": "Wed, 28 Oct 2026 00:00:00 -0400"
  }
}
