{
  "id": "oai:arXiv.org:2608.12368v1",
  "title": "Agreement Is Not Alignment: Divergent Moral Grounds in Human and LLM Ethical Judgments",
  "source": "rss",
  "url": "https://arxiv.org/abs/2608.12368",
  "category": "paper-or-talk",
  "collected_at": "2026-08-15T08:04:30Z",
  "analyzed_at": "2026-08-15T08:04:31Z",
  "organized_at": "2026-08-15T08:08:15Z",
  "summary": "该论文指出，当前以“最终标签与人类判断一致”作为LLM对齐评估标准存在根本缺陷：一致的结果可能源于不同的道德理由。作者构建了基于ETHICS的500项基准，覆盖五个道德领域，并收集了人类与模型对最终标签及支持理由的标注。结果显示，尽管模型在标签层面与人类高度一致，但在理由层面系统性地偏离了人类的道德基础，如对伤害、尊重、守信等类别的关注权重不同。因此，论文强调标签一致性不应等同于对齐，评估需结合理由分析。该研究对AI对齐评估方法提出了重要警示，具有理论和方法论价值。",
  "tags": [
    "llm-alignment",
    "moral-judgment",
    "evaluation-metrics",
    "ethics",
    "rationale-analysis"
  ],
  "relevance_score": 0.63,
  "meta": {
    "feed_name": "arxiv-cs-ai",
    "author": "Octavian M. Machidon, Alina L. Machidon, Vojko Strahovnik, Mateja Centa Strahovnik, Jonas Miklav\\v{c}i\\v{c}, Marko Robnik \\v{S}ikonja",
    "published": "Sat, 15 Aug 2026 00:00:00 -0400"
  }
}
