{
  "id": "oai:arXiv.org:2609.01992v1",
  "title": "ClaimReceipt: Verifying Evidence Sufficiency and Coverage in Agent Evaluations",
  "source": "rss",
  "url": "https://arxiv.org/abs/2609.01992",
  "category": "paper-or-talk",
  "collected_at": "2026-09-03T08:07:02Z",
  "analyzed_at": "2026-09-03T08:07:03Z",
  "organized_at": "2026-09-03T08:10:16Z",
  "summary": "ClaimReceipt 提出了一种针对 Agent 评估的声明验证规范，解决证据充分性和覆盖性问题。它通过将类型化交易证据绑定到签名实验清单，返回 PASS、INVALID 或 INCONCLUSIVE 结果。实验表明其能精确复现人工审计结果，且开销极低。该工作对提升 AI 评估的可信度有重要价值，值得关注。",
  "tags": [
    "agent-evaluation",
    "evidence-verification",
    "receipt-specification",
    "ai-safety",
    "reproducibility"
  ],
  "relevance_score": 0.67,
  "meta": {
    "feed_name": "arxiv-cs-ai",
    "author": "Peiying Zhu, Sidi Chang",
    "published": "Thu, 03 Sep 2026 00:00:00 -0400"
  }
}
